Title,Year,DOI,Authors,References
A practical guide to bibliometric cleaning,2021,10.1016/j.joi.2021.101234,"Smith, J.; Lee, K.","Porter, Michael E. (1985) Competitive advantage: creating and sustaining superior performance. New York: Free Press; Abramo, G.; D'Angelo, C.A. (2014) Scientometrics, 101(2), 1129-1141, https://doi.org/10.1007/s11192-014-1269-8; Sugimoto, C.R.; Lariviere, V. (2018) The Journal of Informetrics, 12(3), 999-1010; Wang, X.; Chen, Y. (2020) Nature Communications, 11, 233; van Eck, N.J.; Waltman, L. (2010) Scientometrics, 84(2), 523-538"
Biblioshiny workflows and reproducibility,2021,,SMITH J; Johnson P.,"Porter, Michael E. (1985) Competitive advantage: creating and sustaining superior performance. New York: Free Press; Abramo, G.; D'Angelo, C.A. (2014) Scientometrics, 101(2), 1129-1141, https://doi.org/10.1007/s11192-014-1269-8; Sugimoto, C.R.; Lariviere, V. (2018) The Journal of Informetrics, 12(3), 999-1010; Wang, X.; Chen, Y. (2020) Nature Communications, 11, 233; van Eck, N.J.; Waltman, L. (2010) Scientometrics, 84(2), 523-538; Porter, Michael E. (1985) Competitive advantage: creating and sustaining superior performance. New York: Free Press; Abramo, G.; D'Angelo, C.A. (2014) Scientometrics, 101(2), 1129-1141, https://doi.org/10.1007/s11192-014-1269-8; Sugimoto, C.R.; Lariviere, V. (2018) The Journal of Informetrics, 12(3), 999-1010; Wang, X.; Chen, Y. (2020) Nature Communications, 11, 233; van Eck, N.J.; Waltman, L. (2010) Scientometrics, 84(2), 523-538"
Citation indexing and its theory,1979,,"Garfield, E.","Price, D.J. de Solla (1963) Little Science, Big Science, Columbia University Press; Merton, R.K. (1968) Social Theory and Social Structure, Free Press; Kuhn, T.S. (1962) The Structure of Scientific Revolutions, University of Chicago Press; Price, D.J. de Solla (1963) Little Science, Big Science, Columbia University Press; Merton, R.K. (1968) Social Theory and Social Structure, Free Press; Kuhn, T.S. (1962) The Structure of Scientific Revolutions, University of Chicago Press"
A smart local moving algorithm for large-scale modularity-based community detection,2013,10.1140/epjb/e2013-40829-0,"Waltman, L.; van Eck, N.J.","Newman, M.E.J. (2004) Physical Review E, 69, 066133; Newman MEJ, 2006, PHYS REV E, V74, P036104; Blondel, V.D. et al. (2008) J Stat Mech P10008; Newman MEJ, 2004, PHYS REV E, V69, P066133; Newman MEJ, 2006, PHYS REV E, V74, P036104; Blondel, V.D. et al. (2008) J Stat Mech P10008"
On the relationship between interdisciplinarity and scientific impact,2014,10.1002/asi.23019,"Lariviere, V.; Gingras, Y.","Porter AL, Rafols I (2009) Res Policy 38 719; Rafols I, Meyer M (2010) Scientometrics 82 263; Uzzi B et al (2013) Science 342 468"
The determinants of academic career advancement: Evidence from Italy,2015,10.1093/scipol/scu086,"Abramo, G; D'Angelo, CA","Porter, Michael E. (1985) Competitive advantage: creating and sustaining superior performance. New York: Free Press; Abramo, G.; D'Angelo, C.A. (2014) Scientometrics, 101(2), 1129-1141, https://doi.org/10.1007/s11192-014-1269-8; Sugimoto, C.R.; Lariviere, V. (2018) The Journal of Informetrics, 12(3), 999-1010; Wang, X.; Chen, Y. (2020) Nature Communications, 11, 233; van Eck, N.J.; Waltman, L. (2010) Scientometrics, 84(2), 523-538"
